{
  "assigned_rater_ids": [
    "reviewer-two",
    "reviewer-one"
  ],
  "id": "pair-converter-review-018",
  "left_alias": "Cedar",
  "left_response_id": "response-converter-review-aurora",
  "order_index": 17,
  "right_alias": "Aster",
  "right_response_id": "response-converter-review-cinder",
  "rubric_id": "general-quality",
  "state": "ready",
  "task_id": "converter-review"
}
