{
  "assigned_rater_ids": [
    "reviewer-two",
    "reviewer-one"
  ],
  "id": "pair-csv-parser-022",
  "left_alias": "Birch",
  "left_response_id": "response-csv-parser-delta",
  "order_index": 21,
  "right_alias": "Dahlia",
  "right_response_id": "response-csv-parser-boreal",
  "rubric_id": "general-quality",
  "state": "ready",
  "task_id": "csv-parser"
}
