{
  "assigned_rater_ids": [
    "reviewer-two",
    "reviewer-one"
  ],
  "id": "pair-rf-fault-039",
  "left_alias": "Birch",
  "left_response_id": "response-rf-fault-delta",
  "order_index": 38,
  "right_alias": "Aster",
  "right_response_id": "response-rf-fault-cinder",
  "rubric_id": "general-quality",
  "state": "ready",
  "task_id": "rf-fault"
}
