{
  "assigned_rater_ids": [
    "reviewer-two",
    "reviewer-one"
  ],
  "id": "pair-table-reading-045",
  "left_alias": "Aster",
  "left_response_id": "response-table-reading-cinder",
  "order_index": 44,
  "right_alias": "Dahlia",
  "right_response_id": "response-table-reading-boreal",
  "rubric_id": "general-quality",
  "state": "ready",
  "task_id": "table-reading"
}
