{
  "assigned_rater_ids": [
    "reviewer-two",
    "reviewer-one"
  ],
  "id": "pair-bilingual-abstract-008",
  "left_alias": "Aster",
  "left_response_id": "response-bilingual-abstract-cinder",
  "order_index": 7,
  "right_alias": "Birch",
  "right_response_id": "response-bilingual-abstract-delta",
  "rubric_id": "general-quality",
  "state": "ready",
  "task_id": "bilingual-abstract"
}
